question,UAE_Lar_V1_Vercit,UAE_Lar_V1_Score,Bge_lar_Verdict,Bge_lar_Score,EmberV1_Verdict,EmberV1_Score,SF_E5_Verdict,SF_E5_Score
How do geopolitical factors impact the Oil and Gas industry?,Correct,59.93,InCorrect,81.72,Correct,53.24,Correct,51.86
What role do protective coatings play in the Oil and Gas industry?,Correct,62.87,Correct,84.32,Correct,59.09,Correct,56.23
What challenges does the Mining industry face in terms of environmental impact?,Correct,71.66,Correct,84.11,Correct,66.87,Correct,66.07
What technologies are involved in Oil and Gas exploration?,InCorrect,65.36,Correct,82.27,InCorrect,60.93,InCorrect,59.28
How are advanced painting techniques used in industrial settings?,InCorrect,67.86,InCorrect,82.32,InCorrect,60.35,InCorrect,59.63
What measures are taken in the Mining industry to address environmental concerns?,Correct,70.72,InCorrect,82.98,Correct,63.58,Correct,63.56
How does the Oil and Gas industry adapt to changing market conditions?,Correct,63.92,InCorrect,82.23,Correct,57.75,InCorrect,54.83
What skills are essential for professionals in the industrial Painting sector?,InCorrect,66.97,InCorrect,81.76,InCorrect,59.53,InCorrect,57.28
What is the critical role of mining in the production of essential metals?,InCorrect,67.35,InCorrect,81.09,Correct,63.2,Correct,59.51
How does the Oil and Gas industry invest in sustainable practices?,Correct,69.02,Correct,85.19,Correct,66.47,Correct,66.33
"What are the different activities involved in the upstream, midstream, and downstream sectors of the Oil and Gas industry?",Correct,64.78,Correct,83.45,Correct,60.86,Correct,57.91
How does the Painting industry contribute to ecological sustainability through coatings?,Correct,75.44,InCorrect,88.45,InCorrect,74.64,Correct,72.78
What sustainability practices are adopted by the Mining sector to address social and environmental concerns?,InCorrect,72.93,Correct,86.31,InCorrect,69.9,InCorrect,69.28
What advanced technologies are utilized in Oil and Gas exploration for accurate resource estimates?,Correct,59.68,Correct,80.05,Correct,56.31,Correct,54.32
What safety protocols are followed by industrial Painting professionals in Oil and Gas facilities and mining sites?,InCorrect,61.68,Correct,81.86,InCorrect,56.97,InCorrect,54.44
How do sustainable mining practices balance resource extraction with environmental conservation?,Correct,72.29,InCorrect,84.82,InCorrect,69.61,InCorrect,66.98
What regulatory challenges does the Oil and Gas industry face in terms of environmental protection?,Correct,64.81,Correct,82.68,Correct,59.96,Correct,56.26
How do protective coatings in the Painting industry withstand harsh weather conditions?,InCorrect,64.33,InCorrect,82.59,Correct,60.26,Correct,56.65
What innovative technologies are employed by mining companies to optimize resource extraction processes?,InCorrect,65.25,InCorrect,82.22,InCorrect,60.71,InCorrect,61.26
How is the Oil and Gas industry adapting to the transition to renewable energy sources?,InCorrect,65.36,Correct,82.6,InCorrect,58.6,InCorrect,58.64
How do Oil and Gas exploration projects collaborate with environmental scientists to assess impact?,Correct,63.72,Correct,82.83,Correct,63.27,Correct,59.35
What are some common coating materials used by Painting specialists in the industrial sector?,InCorrect,67.82,InCorrect,85.14,InCorrect,61.34,InCorrect,60.62
How do mining companies prioritize community engagement in social responsibility programs?,Correct,66.93,Correct,83.8,Correct,66.77,Correct,65.08
What role do directional drilling techniques play in Oil and Gas drilling operations?,Correct,58.3,Correct,80.16,Correct,57.13,Correct,52.23
Why is corrosion prevention crucial in protective coatings for the Painting industry?,Correct,66.73,Correct,84.98,Correct,61.7,Correct,57.67
How do mining engineers utilize advanced technologies like data analytics and automation for optimizing extraction processes?,Correct,66.75,Correct,83.57,Correct,63.06,Correct,60.21
What innovations is the Oil and Gas industry investing in to reduce the carbon footprint?,InCorrect,66.72,Correct,83.51,Correct,62.78,InCorrect,61.99
Why is surface preparation important in industrial painting projects for Oil and Gas facilities and mining infrastructure?,Correct,67.98,InCorrect,83.92,Correct,63.13,Correct,60.06
How do mining companies implement reclamation efforts to restore mined areas?,Correct,60.74,InCorrect,80.87,Correct,54.83,InCorrect,52.24
What career opportunities exist for skilled professionals in the growing Oil and Gas industry?,InCorrect,61.55,Correct,80.87,InCorrect,56.15,InCorrect,57.82
How is automation being utilized in the Oil and Gas industry to enhance operational efficiency?,Correct,58.18,Correct,81.45,Correct,53.89,Correct,50.63
What role do fire-resistant coatings play in painting projects for Oil and Gas installations?,InCorrect,61.63,Correct,83.42,Correct,57.31,InCorrect,54.23
How do mining sustainability initiatives address responsible water management practices?,Correct,68.53,Correct,84.8,Correct,68.87,InCorrect,64.25
What is the significance of refineries in the Oil and Gas industry in processing raw materials?,Correct,64.47,Correct,85.38,Correct,61.25,Correct,58.65
How do industrial painters in the Oil and Gas sector use abrasive blasting techniques for surface preparation?,InCorrect,61.95,InCorrect,80.8,Correct,57.1,InCorrect,53.86
What efforts do mining companies take to engage in biodiversity conservation near mining sites?,Correct,67.11,Correct,85.0,Correct,62.6,Correct,61.16
"Why is safety training crucial in the Oil and Gas industry, and what does it involve?",Correct,59.42,Correct,82.81,Correct,55.89,Correct,51.58
How do painting professionals use thermal spray coatings in industrial settings?,Correct,69.26,Correct,83.06,Correct,64.84,Correct,63.29
What is the role of automation in enhancing efficiency and safety in mining operations?,Correct,63.62,Correct,83.59,Correct,60.85,Correct,57.19
How is the Oil and Gas industry addressing the demand for energy-efficient technologies?,InCorrect,65.37,Correct,84.44,InCorrect,59.2,InCorrect,58.7
