question,UAE_Lar_V1_Vercit,UAE_Lar_V1_Score,Bge_lar_Verdict,Bge_lar_Score,EmberV1_Verdict,EmberV1_Score,SF_E5_Verdict,SF_E5_Score
How do geopolitical factors impact the Oil and Gas industry?,InCorrect,80.62,InCorrect,91.86,InCorrect,75.96,InCorrect,77.27
What role do protective coatings play in the Oil and Gas industry?,InCorrect,84.94,InCorrect,92.6,InCorrect,84.0,InCorrect,85.06
What challenges does the Mining industry face in terms of environmental impact?,Correct,83.25,Correct,91.97,Correct,81.7,Correct,84.79
What technologies are involved in Oil and Gas exploration?,Correct,87.77,Correct,93.81,Correct,83.73,Correct,85.78
How are advanced painting techniques used in industrial settings?,InCorrect,78.62,InCorrect,88.34,InCorrect,72.1,InCorrect,71.89
What measures are taken in the Mining industry to address environmental concerns?,Correct,82.01,Correct,90.36,Correct,79.42,Correct,83.01
How does the Oil and Gas industry adapt to changing market conditions?,Correct,86.44,Correct,92.33,Correct,82.06,Correct,83.38
What skills are essential for professionals in the industrial Painting sector?,Correct,82.14,Correct,90.2,Correct,74.9,Correct,74.69
What is the critical role of mining in the production of essential metals?,Correct,85.9,Correct,92.27,Correct,85.12,Correct,85.19
How does the Oil and Gas industry invest in sustainable practices?,InCorrect,82.3,Correct,91.03,InCorrect,77.96,InCorrect,80.91
"What are the different activities involved in the upstream, midstream, and downstream sectors of the Oil and Gas industry?",Correct,90.42,Correct,93.64,Correct,87.2,Correct,88.28
How does the Painting industry contribute to ecological sustainability through coatings?,Correct,83.57,Correct,91.58,Correct,79.16,Correct,81.9
What sustainability practices are adopted by the Mining sector to address social and environmental concerns?,Correct,91.24,Correct,94.68,Correct,87.9,Correct,89.93
What advanced technologies are utilized in Oil and Gas exploration for accurate resource estimates?,Correct,86.42,Correct,93.69,Correct,84.0,Correct,85.36
What safety protocols are followed by industrial Painting professionals in Oil and Gas facilities and mining sites?,Correct,93.07,Correct,94.95,Correct,91.49,Correct,93.25
How do sustainable mining practices balance resource extraction with environmental conservation?,InCorrect,86.49,Correct,92.24,InCorrect,84.6,InCorrect,87.09
What regulatory challenges does the Oil and Gas industry face in terms of environmental protection?,Correct,89.99,Correct,94.57,Correct,87.07,Correct,89.06
How do protective coatings in the Painting industry withstand harsh weather conditions?,Correct,88.36,Correct,92.17,Correct,86.2,Correct,86.4
What innovative technologies are employed by mining companies to optimize resource extraction processes?,Correct,81.31,Correct,92.46,Correct,79.06,Correct,81.34
How is the Oil and Gas industry adapting to the transition to renewable energy sources?,Correct,87.68,Correct,93.67,Correct,80.84,Correct,85.25
How do Oil and Gas exploration projects collaborate with environmental scientists to assess impact?,Correct,90.39,Correct,93.7,Correct,87.09,Correct,89.52
What are some common coating materials used by Painting specialists in the industrial sector?,Correct,89.06,Correct,93.73,Correct,86.11,Correct,87.15
How do mining companies prioritize community engagement in social responsibility programs?,Correct,94.8,Correct,95.73,Correct,91.79,Correct,93.41
What role do directional drilling techniques play in Oil and Gas drilling operations?,Correct,92.03,Correct,95.77,Correct,88.21,Correct,89.56
Why is corrosion prevention crucial in protective coatings for the Painting industry?,Correct,91.86,Correct,95.28,Correct,89.49,Correct,91.46
How do mining engineers utilize advanced technologies like data analytics and automation for optimizing extraction processes?,Correct,89.05,Correct,93.19,Correct,87.51,Correct,88.5
What innovations is the Oil and Gas industry investing in to reduce the carbon footprint?,Correct,86.93,Correct,93.1,Correct,82.73,Correct,83.95
Why is surface preparation important in industrial painting projects for Oil and Gas facilities and mining infrastructure?,Correct,93.38,Correct,95.24,Correct,91.15,Correct,93.17
How do mining companies implement reclamation efforts to restore mined areas?,Correct,80.11,Correct,90.96,Correct,78.8,Correct,80.86
What career opportunities exist for skilled professionals in the growing Oil and Gas industry?,Correct,86.39,Correct,94.21,Correct,81.72,Correct,86.16
How is automation being utilized in the Oil and Gas industry to enhance operational efficiency?,Correct,91.69,Correct,95.64,Correct,89.4,Correct,91.54
What role do fire-resistant coatings play in painting projects for Oil and Gas installations?,Correct,89.14,Correct,95.17,Correct,90.16,Correct,91.12
How do mining sustainability initiatives address responsible water management practices?,Correct,93.85,Correct,95.2,Correct,90.77,Correct,92.31
What is the significance of refineries in the Oil and Gas industry in processing raw materials?,Correct,86.76,Correct,95.39,Correct,86.08,Correct,87.77
How do industrial painters in the Oil and Gas sector use abrasive blasting techniques for surface preparation?,Correct,95.43,Correct,95.9,Correct,91.88,Correct,93.27
What efforts do mining companies take to engage in biodiversity conservation near mining sites?,Correct,93.57,Correct,95.64,Correct,88.89,Correct,92.24
"Why is safety training crucial in the Oil and Gas industry, and what does it involve?",Correct,91.49,Correct,95.91,Correct,87.61,Correct,90.76
How do painting professionals use thermal spray coatings in industrial settings?,Correct,91.81,Correct,93.63,Correct,87.15,Correct,89.08
What is the role of automation in enhancing efficiency and safety in mining operations?,Correct,90.3,Correct,94.83,Correct,87.38,Correct,90.35
How is the Oil and Gas industry addressing the demand for energy-efficient technologies?,Correct,90.17,Correct,94.26,Correct,85.36,Correct,89.08
